{
  "contract_id": "domain-data-product-consumers",
  "contract_version": "1.0.0",
  "governed_by_rfc": "RFC-0084",
  "consumer_repository": "lotus-risk",
  "dependencies": [
    {
      "product_name": "ReturnsSeriesBundle",
      "producer_repository": "lotus-performance",
      "required_product_version": "v1",
      "consumption_mode": "api_read",
      "business_purpose": "Source performance-aligned portfolio and benchmark return observations for stateful risk, drawdown, rolling, and attribution workflows.",
      "validation_lanes": ["feature", "pr-merge"],
      "failure_posture": "fail_closed"
    },
    {
      "product_name": "BenchmarkExposureContext",
      "producer_repository": "lotus-performance",
      "required_product_version": "v1",
      "consumption_mode": "paged_api_read",
      "business_purpose": "Source performance-aligned benchmark exposure rows for approved stateful active-risk attribution workflows.",
      "validation_lanes": ["feature", "pr-merge"],
      "failure_posture": "degrade_to_partial"
    },
    {
      "product_name": "PortfolioStateSnapshot",
      "producer_repository": "lotus-core",
      "required_product_version": "v1",
      "consumption_mode": "api_read",
      "business_purpose": "Resolve governed portfolio state for concentration stateful and simulation flows.",
      "validation_lanes": ["feature", "pr-merge"],
      "failure_posture": "fail_closed"
    },
    {
      "product_name": "PositionTimeseriesInput",
      "producer_repository": "lotus-core",
      "required_product_version": "v1",
      "consumption_mode": "api_read",
      "business_purpose": "Source historical position exposure rows for stateful historical risk attribution.",
      "validation_lanes": ["feature", "pr-merge"],
      "failure_posture": "fail_closed"
    },
    {
      "product_name": "InstrumentReferenceBundle",
      "producer_repository": "lotus-core",
      "required_product_version": "v1",
      "consumption_mode": "paged_api_read",
      "business_purpose": "Resolve governed instrument, issuer, and classification reference context for concentration and attribution outputs.",
      "validation_lanes": ["feature", "pr-merge"],
      "failure_posture": "fail_closed"
    },
    {
      "product_name": "RiskFreeSeriesWindow",
      "producer_repository": "lotus-core",
      "required_product_version": "v1",
      "consumption_mode": "api_read",
      "business_purpose": "Source governed risk-free series context when rolling Sharpe requires explicit upstream risk-free treatment.",
      "validation_lanes": ["feature", "pr-merge"],
      "failure_posture": "degrade_to_partial"
    }
  ]
}
